{
  "$schema": "https://json-schema.org/draft/2020-12/schema",
  "title": "kai-report-creator captured-run style rubric",
  "type": "object",
  "additionalProperties": false,
  "required": ["case_id", "overall_pass", "score", "checks", "summary"],
  "properties": {
    "case_id": {"type": "string", "minLength": 1},
    "overall_pass": {"type": "boolean"},
    "score": {"type": "integer", "minimum": 0, "maximum": 100},
    "checks": {
      "type": "array",
      "minItems": 4,
      "items": {
        "type": "object",
        "additionalProperties": false,
        "required": ["id", "pass", "score", "notes"],
        "properties": {
          "id": {
            "type": "string",
            "enum": [
              "async_readability",
              "visual_rhythm",
              "evidence_fidelity",
              "no_ai_slop",
              "theme_appropriateness",
              "decision_support"
            ]
          },
          "pass": {"type": "boolean"},
          "score": {"type": "integer", "minimum": 1, "maximum": 5},
          "notes": {"type": "string", "minLength": 1}
        }
      }
    },
    "summary": {"type": "string", "minLength": 1}
  }
}
